{
  "schemaVersion": "1.0.0",
  "id": "IOS-FND-Z-INDEX",
  "name": "Z-index foundation",
  "type": "foundation",
  "status": "implementation",
  "version": "0.1.0",
  "owner": "unassigned",
  "figmaUrl": null,
  "figmaNodeId": null,
  "documentationPath": "docs/design-system/tokens/naming-conventions.md",
  "codePath": "packages/tokens/src/primitives/z-index.tokens.json",
  "storybookPath": null,
  "aiMetadataPath": null,
  "accessibilityStatus": "not-applicable",
  "reviewStatus": "draft",
  "lastReviewedDate": null,
  "dependencies": [{ "id": "IOS-FND-TOKEN-ARCHITECTURE" }],
  "relatedItems": [],
  "evidenceLinks": []
}
